GALLETAS OREO CHOCOLATE 118G,GALLETAS OREO CHOCOLATE 118G,/Almacén/Desayuno y Merienda/Galletitas dulces/,196.49,196.49,https://www.hiperlibertad.com.ar/galletas-oreo-chocolate-118g/p,8,473107
"PIEDRAS SANITARIAS DRY WAY X 4,6 Lts","PIEDRAS SANITARIAS DRY WAY X 4,6 Lts",/Mascotas/ACCESORIOS PARA MASCOTAS/LIMPIEZA/,340.99,340.99,https://www.hiperlibertad.com.ar/piedras-sanitarias-dry-way-x-4-6-lts-2/p,92,472989
PAN ARABE X 4 UN ECOMM C/CPC,PAN ARABE X 4 UN,/Almacén/Panificados/Elaboración Propia/,94.99,94.99,https://www.hiperlibertad.com.ar/pan-arabe-x-4-un/p,72,472951
MEDIALUNAS  X UN ECOMM C/CPC,MEDIALUNAS  X UN,/Almacén/Panificados/Elaboración Propia/,49.99,49.99,https://www.hiperlibertad.com.ar/medialunas-x-un-3/p,1893,472949
YERBA MATE AMANDA EDICION 1950 500 GRS,YERBA MATE AMANDA EDICION 1950 500 GRS,/Almacén/Desayuno y Merienda/Yerbas/,304.22,304.22,https://www.hiperlibertad.com.ar/yerba-mate-amanda-edicion-1950-500-grs/p,24,472834
DULCE DE LECHE LA SERENÍSIMA TRAD 400G,DULCE DE LECHE LA SERENÍSIMA TRAD 400G,/Lácteos/Dulce de Leche/Tradicional/,366.99,366.99,https://www.hiperlibertad.com.ar/dulce-de-leche-la-serenisima-trad-400g/p,59,472832
DULCE DE LECHE REP LA SERENÍSIMA 400G DULCE DE LECHE REP LASERENISIMA400G,DULCE DE LECHE REP LA SERENÍSIMA 400G,/Lácteos/Dulce de Leche/Repostero/,386.99,386.99,https://www.hiperlibertad.com.ar/dulce-de-leche-rep-la-serenisima-400g/p,3,472828
COCTEL 4 FRUT/CEREZ AGROSABOR,COCTEL 4 FRUT/CEREZ AGROSABOR,/Almacén/Conservas/Conservas de frutas/,642.99,642.99,https://www.hiperlibertad.com.ar/coctel-4-frut-cerez-agrosabor/p,19,472819
QUESO BLANCO TREGAR  CLASICO 300GR,QUESO BLANCO TREGAR  CLASICO 300GR,/QUESOS Y FIAMBRES/Quesos/Quesos untables/,259.99,259.99,https://www.hiperlibertad.com.ar/queso-blanco-tregar-clasico-300gr/p,57,472790
Celular Samsung Galaxy A52 Negro,"&nbsp;
Pantalla asombrosa, desplazamiento extrafluido

Disfrut&aacute; de los detalles realmente vibrantes con la pantalla Super&nbsp;AMOLED&nbsp;Display&nbsp;FHD+, que alcanza los 800&nbsp;nits&sup1; para mayor claridad, incluso con la luz de d&iacute;a brillante. Eye Comfort Shield&sup2; reduce la luz azul y la pantalla extrafluida mantiene la vista relajada, ya sea que est&eacute;s jugando o navegando. Todo en la amplia pantalla Infinity-O Display de 6,5&nbsp;pulgadas.
&nbsp;

&nbsp;
C&aacute;mara asombrosa, siempre n&iacute;tida y estable

El sistema de c&aacute;maras con m&uacute;ltiples lentes del Galaxy&nbsp;A52 lleva las fotos al siguiente nivel. Consegu&iacute; una resoluci&oacute;n ultraalta en la c&aacute;mara principal de 64&nbsp;MP con OIS para tomar fotos n&iacute;tidas y claras durante todo el d&iacute;a. Expand&iacute; el &aacute;ngulo de visi&oacute;n con la c&aacute;mara ultraancha. Personaliz&aacute; el enfoque con la c&aacute;mara de profundidad o mir&aacute; los detalles de cerca con la c&aacute;mara macro.

&nbsp;
Captura detalles incluso con poca luz gracias a OIS

Olvidate de las fotos y los videos borrosos. La estabilizaci&oacute;n &oacute;ptica de imagen (Optical Image Stabilization, OIS) ayuda a estabilizar tus tomas para mantener el movimiento fluido y las im&aacute;genes n&iacute;tidas, incluso cuando hay poca luz. La c&aacute;mara capta m&aacute;s luz para mejorar las tomas con poca luz.
&nbsp;

&nbsp;
C&aacute;mara ultraancha, experiencias infinitas
Al igual que la vista humana, la c&aacute;mara ultraancha de 12&nbsp;MP ve el mundo con un &aacute;ngulo de visi&oacute;n de 123&nbsp;grados para agregar m&aacute;s perspectiva a todo lo que capturas.
&nbsp;

&nbsp;
La c&aacute;mara macro destaca los peque&ntilde;os detalles

Acercate a la c&aacute;mara macro de 5&nbsp;MP y sac&aacute; a relucir los detalles ultrafinos de tus fotos. Aplic&aacute; un efecto bokeh natural a tus im&aacute;genes para que tu sujeto se destaque del fondo.
&nbsp;

&nbsp;
Con Super&nbsp;Steady estar&aacute;s siempre listo

En el modo Super&nbsp;Steady, el Galaxy&nbsp;A52 mantiene tus videos listos con un aspecto fluido y estable. Graba como una c&aacute;mara de acci&oacute;n de alta calidad, ya que utiliza la c&aacute;mara ultraancha y un software predictivo.

&nbsp;
Pon el foco al frente con la c&aacute;mara de profundidad
La c&aacute;mara de profundidad de 5&nbsp;MP te permite ajustar la profundidad de campo en tus fotos. Con un simple toque, podr&aacute;s ajustar f&aacute;cilmente el desenfoque de fondo detr&aacute;s del sujeto fotografiado para obtener tomas de retratos de alta calidad que realmente se destacan.
&nbsp;

&nbsp;
C&aacute;mara frontal de alta resoluci&oacute;n, selfies impresionantes

La c&aacute;mara frontal de 32&nbsp;MP del Galaxy&nbsp;A52 toma selfies claras de alta resoluci&oacute;n durante todo el d&iacute;a. Y con el efecto bokeh para difuminar suavemente el fondo, ser&aacute;s la estrella de la foto.
&nbsp;

&nbsp;
Resistente a derrames y salpicaduras

Con la clasificaci&oacute;n&nbsp;IP67 por su resistencia al agua y al polvo, este tel&eacute;fono soporta hasta 1,0&nbsp;metros de agua durante 30&nbsp;minutos.&sup1; As&iacute; que no te preocupes si tu tel&eacute;fono se moja un poco y quieres seguir jugando o tomando fotos.
&nbsp;

&nbsp;
Sonido envolvente en la palma de la mano

Con dos altavoces, uno en la parte superior y otro en la parte inferior, tendr&aacute;s una experiencia de sonido est&eacute;reo sin tener que usar los auriculares. Disfruta una noche de pel&iacute;culas o tus juegos favoritos con un sonido cinematogr&aacute;fico que te dejar&aacute; en medio de la escena.
&nbsp;

&nbsp;
Bater&iacute;a asombrosa que dura dos d&iacute;as&sup1;

Con la bater&iacute;a de 4500&nbsp;mAh (t&iacute;pico)&sup2; tendr&aacute;s m&aacute;s tiempo para hacer lo que te gusta: transmitir o compartir contenido, jugar y m&aacute;s. La administraci&oacute;n de energ&iacute;a de IA detecta y se ajusta a tus h&aacute;bitos de uso m&oacute;vil para ofrecerte una energ&iacute;a duradera. Y con una carga superr&aacute;pida de hasta 25&nbsp;V, el Galaxy&nbsp;A52 vuelve a su m&aacute;xima potencia r&aacute;pidamente.
&nbsp;

&nbsp;
Rendimiento asombroso para mantenerte el ritmo

Ya sea que est&eacute;s enfocado en una tarea o en varias tareas a la vez, el Galaxy&nbsp;A52 ofrece un excelente rendimiento gracias a su procesador avanzado de ocho n&uacute;cleos y hasta 6&nbsp;GB de RAM. Almacena m&aacute;s y elimina menos con 128&nbsp;GB de almacenamiento interno. Y, si no es suficiente, agrega hasta 1&nbsp;TB con la tarjeta MicroSD.
&nbsp;

&nbsp;
Game Booster te da ventaja

Maximiza el rendimiento con Game Booster. Reduce las distracciones y mejora tu juego con una interfaz exclusiva y un men&uacute; de f&aacute;cil acceso. Frame Booster proporciona un movimiento suave y realista de los gr&aacute;ficos. Juega al m&aacute;ximo mientras Game Booster aprende tus patrones de uso para optimizar la bater&iacute;a, la temperatura y la memoria.
&nbsp;

&nbsp;
Protege lo que te importa

Incorporado en el hardware y software del tel&eacute;fono desde el principio, Samsung Knox protege tu tel&eacute;fono desde el momento en que se enciende. Ofrece seguridad en varios niveles y protege tu informaci&oacute;n de malware y amenazas maliciosas.
&nbsp;


&nbsp;
&nbsp;
Seguro con un simple toque

El sensor de huella digital en la pantalla del Galaxy&nbsp;A52 reconoce tu huella dactilar para que puedas desbloquear el tel&eacute;fono de forma sencilla y segura. Adem&aacute;s, con los servicios de autenticaci&oacute;n biom&eacute;trica de Samsung&nbsp;Pass, tu huella dactilar proporciona un m&eacute;todo de autenticaci&oacute;n m&aacute;s r&aacute;pido y seguro para el inicio de sesi&oacute;n en aplicaciones y sitios web.
&nbsp;

&nbsp;
Una experiencia Android&trade; asombrosa, siempre

Consigue las &uacute;ltimas aplicaciones de Google con el SO de Android, totalmente compatibles con tu Galaxy&nbsp;A52.
&nbsp;

A tu alcance en cualquier lugar o momento

Disfruta de la tranquilidad que implica tener un tel&eacute;fono inteligente Galaxy. El diagn&oacute;stico interactivo y la mejora de la aplicaci&oacute;n Samsung&nbsp;Members facilitan la optimizaci&oacute;n del rendimiento de tus dispositivos, mientras que nuestra l&iacute;nea de ayuda te ayuda a solucionar cualquier problema si necesitas asistencia.
&nbsp;

&nbsp;
Soporte Remoto

Un experto de Samsung se conectar&aacute; remotamente a tu dispositivo a trav&eacute;s de una aplicaci&oacute;n de soporte para configurar tu equipo, responder consultas y optimizar tu Galaxy.Este servicio es completamente&nbsp;gratis&nbsp;y seguro.
&nbsp;



&nbsp;
&nbsp;
&nbsp;
&nbsp;",/Tecnología/CELULARES Y TABLETS/CELULARES/,95999.0,95999.0,https://www.hiperlibertad.com.ar/celular-samsung-galaxy-a52-negro/p,9,472575
Celular Samsung Galaxy A32 Negro,"CELULAR SAMSUNG A32
Cuenta con una pantalla Infinity-U Super AMOLED de 6.4 pulgadas a resoluci&oacute;n Full HD+, y potenciado por un procesador Mediatek Helio G80 con opciones de 4GB, 6GB o 8GB de memoria RAM y 64GB o 128GB de almacenamiento interno expandible. En cuanto a c&aacute;maras, el Galaxy A32 cuenta con una c&aacute;mara cu&aacute;druple en su posterior, con lentes de 64MP, 8MP, 5MP y 5MP, y su c&aacute;mara frontal para selfies es de 20 megapixels. Completando las caracter&iacute;sticas del Galaxy A32 encontramos una bater&iacute;a de 5000 mAh de carga r&aacute;pida, lector de huellas integrado en pantalla, vidrio reforzado Gorilla Glass 5 tanto al frente como en su dorsal y One UI 3.0 basado en Android 11.
CARACTER&Iacute;STICAS PRINCIPALES
*Pantalla: 6.4&rsquo;&rsquo;, 1800 x 2400 pixels&nbsp;*Procesador: Octa-core, 2.0 GHz*RAM: 4 GB*Almacenamiento: 128 GB*Expansi&oacute;n: MicroSD, Hasta 1 TB*C&aacute;mara: Quad, 64 MP + 8 MP + 5 MP + 5 MP*Bater&iacute;a: 5000 mAh*OS: Android 11, One UI 3.0*SIM: Cantidad: Dual-SIM / Tama&ntilde;o: Nano-SIMREDES&nbsp;2G GSM 850 / 900 / 1800 / 1900 SIM 1 &amp; SIM 23G HSDPA 850 / 900 / 1900 / 2100&nbsp;4G LTETAMA&Ntilde;O&nbsp;Dimensiones: 158.9 x 73.6 x 8.4 mmPeso: 184 gMateriales: Frente y posterior de vidrio (Gorilla Glass 5)DISPLAY&nbsp;Tecnolog&iacute;a: Super AMOLEDTama&ntilde;o: 6.4 pulgadasResoluci&oacute;n: 1080 x 2400 pixelsDensidad: 411 ppiProtecci&oacute;n: Gorilla GlassPLATAFORMA&nbsp;Sistema Operativo: Android 10, One UI 3.0Procesador: Mediatek Helio G80Tipo de CPU: Octa-core (2x2.0 GHz Cortex-A75 &amp; 6x1.8 GHz Cortex-A55)GPU: Mail-G52MEMORIA&nbsp;Almacenamiento Interno: 128 GB, RAM: 4 GBMemoria externa: MicroSD, hasta 1 TBC&Aacute;MARA&nbsp;C&aacute;mara Principal: Quad - 64 MP (f/1.8) + 8 MP (f/2.2) + 5 MP (f/2.4) + 5 MP (f/2.4)Funciones: autofocus, flash LED, panorama, HDRVideo: 1080p@30C&aacute;mara Frontal: 20 MP (f/2.2); Video: 1080p@30CONECTIVIDAD&nbsp;Wi-Fi: Wi-Fi 802.11 a/b/g/n/ac, WiFi direct, banda dualBluetooth: v5.0 LE, A2DPGPS: GPS con soporte A-GPS, GLONASSUSB: USB 2.0, Tipo-C, OTGNFC: SiSONIDO&nbsp;Altoparlante: SiConectividad auricular: 3.5 mmRadio FM: SiCARACTER&Iacute;STICAS&nbsp;Sensores: Aceler&oacute;metro, proximidad, br&uacute;jula digitalTipo de desbloqueo: C&oacute;digo/patr&oacute;n, reconocimiento facial, lector de huellaResistencia al agua: NoBATER&Iacute;A&nbsp;Capacidad: 5000 mAhTipo Li-Po, No Extra&iacute;ble&nbsp;Carga r&aacute;pida: Si, 15 WCarga inal&aacute;mbrica: No",/Tecnología/CELULARES Y TABLETS/CELULARES/,75999.0,75999.0,https://www.hiperlibertad.com.ar/celular-samsung-galaxy-a32-negro/p,4,472571
MOPA BLANCA DURAMAS MAX,MOPA BLANCA DURAMAS MAX,/Limpieza/Accesorios de Limpieza/Baldes y Mopas/,436.99,436.99,https://www.hiperlibertad.com.ar/mopa-blanca-duramas-max/p,56,472421
QUITAMANCHAS AYUDÍN BLANCOS INTENSOS 2L QUITAMANCHAS AYUDÍN BLACO INTENSO 2L,QUITAMANCHAS AYUDÍN BLANCOS INTENSOS 2L,/Limpieza/Cuidado de la Ropa/Quitamanchas/,363.49,363.49,https://www.hiperlibertad.com.ar/quitamanchas-ayudin-blancos-intensos-2l/p,84,472414
LECHE LA SERENÍSIMA PROTEIN UAT 0% PET 1L LECHE PROT UAT 0% PET 1 L,LECHE LA SERENÍSIMA PROTEIN UAT 0% PET 1L,/Lácteos/Leches/Larga Vida/,329.99,329.99,https://www.hiperlibertad.com.ar/leche-la-serenisima-protein-uat-0-pet-1l/p,239,472356
LECHE LA SERENÍSIMA 0% DESCR UAT 1L LECHE LS 0% DESCR UAT 1 L,LECHE LA SERENÍSIMA 0% DESCR UAT 1L,/Lácteos/Leches/Larga Vida/,239.99,239.99,https://www.hiperlibertad.com.ar/leche-la-serenisima-0-descr-uat-1l/p,278,472355
PAN DE LOMO SAN ALFONSO X 2U,PAN DE LOMO SAN ALFONSO X 2U,/Almacén/Panificados/Pan Lactal/,151.99,151.99,https://www.hiperlibertad.com.ar/pan-de-lomo-san-alfonso-x-2u/p,13,472255
MATECOCIDO UNION S/E DIA 50 SAQUITOS,MATECOCIDO UNION S/E DIA 50 SAQUITOS,/Almacén/Desayuno y Merienda/Yerbas/,220.17,220.17,https://www.hiperlibertad.com.ar/matecocido-union-s-e-dia-50-saquitos/p,157,472253
MATECOCIDO TARAGUI 25U,MATECOCIDO TARAGUI 25U,/Almacén/Desayuno y Merienda/Yerbas/,118.24,118.24,https://www.hiperlibertad.com.ar/matecocido-taragui-25u/p,1346,472250
YOGUR YOGURISIMO GRIEGO FRUTILLA 125 GRS,YOGUR YOGURISIMO GRIEGO FRUTILLA 125 GRS,/Lácteos/Yogures/Firmes/,239.49,199.1,https://www.hiperlibertad.com.ar/yogur-yogurisimo-griego-frutilla-125-grs/p,4,472151
QUESO FINLANDIA PROCE POT 290 GRS,QUESO FINLANDIA PROCE POT 290 GRS,/QUESOS Y FIAMBRES/Quesos/Quesos untables/,566.99,566.99,https://www.hiperlibertad.com.ar/queso-finlandia-proce-pot-290-grs/p,153,472101
QUESO RALLADO LA SERENÍSIMA BOLSA 70 GRS,QUESO RALLADO LA SERENÍSIMA BOLSA 70 GRS,/QUESOS Y FIAMBRES/Quesos/Quesos duros/,359.99,359.99,https://www.hiperlibertad.com.ar/queso-rallado-la-serenisima-bolsa-70-grs/p,23,472079
QUESO RALLADO LA SERENÍSIMA BOLSA 35 GR,QUESO RALLADO LA SERENÍSIMA BOLSA 35 GR,/QUESOS Y FIAMBRES/Quesos/Quesos duros/,193.99,193.99,https://www.hiperlibertad.com.ar/queso-rallado-la-serenisima-bolsa-35-gr/p,55,472071
QUESO RALLADO GRANJA DE ORO X 120GR,QUESO RALLADO GRANJA DE ORO X 120GR,/QUESOS Y FIAMBRES/Quesos/Quesos duros/,419.99,419.99,https://www.hiperlibertad.com.ar/queso-rallado-granja-de-oro-x-120gr/p,102,472068
LECHUGA MANTECOSA X 500 G,LECHUGA MANTECOSA x 500 g,/Frutas y Verduras/Verduras/Verduras sueltas/,249.0,249.0,https://www.hiperlibertad.com.ar/lechuga-mantecosa-x-500-g/p,26,471935
CIRUELA X 500 G,CIRUELA x 500 g,/Frutas y Verduras/Frutas/Frutas sueltas/,399.0,399.0,https://www.hiperlibertad.com.ar/ciruela-x-500-g/p,93,471915
PIÑA x 1 kg,PIÑA x 1 kg,/Frutas y Verduras/Frutas/Frutas sueltas/,329.0,329.0,https://www.hiperlibertad.com.ar/pina-x-1-kg/p,4,471914
Shampoo para bebé JOHNSON'S® pH Balanceado x 400 ml.,SH J J GOLD 12X400ML,/Bebés y Niños/HIGIENE Y SALUD/PARA EL BAÑO/,761.99,761.99,https://www.hiperlibertad.com.ar/sh-j-j-gold-12x400ml/p,17,471865
OJO DE BIFE DE NOVILLITO X 500 G,OJO DE BIFE DE NOVILLITO x 500 g,/CARNES/Carne vacuna/,799.5,799.5,https://www.hiperlibertad.com.ar/ojo-de-bife-de-novillito-x-500-g/p,9,471755
COSTELETA DE NOVILLITO X 1 KG,COSTELETA DE NOVILLITO x 1 kg,/CARNES/Carne vacuna/,1369.0,1369.0,https://www.hiperlibertad.com.ar/costeleta-de-novillito-x-1-kg/p,37,471750
COSTILLA DE NOVILLITO X 1 KG,COSTILLA DE NOVILLITO x 1 kg,/CARNES/Carne vacuna/,1349.0,1349.0,https://www.hiperlibertad.com.ar/costilla-de-novillito-x-1-kg/p,130,471749
MILANESAS MANJAR GARB AVN 4 UN MIL MANJAR GARB AVN 4 UN,MILANESAS MANJAR GARB AVN 4 UN,/CONGELADOS/Hamburguesas y milanesas/,249.99,249.99,https://www.hiperlibertad.com.ar/milanesas-manjar-garb-avn-4-un/p,26,471637
FRAZADA NEVADA 2PL PETROLEO,"FRAZADA NEVADA 2 PLAZAS 210CMX200CM CORAL, 100% FIBRA POLIESTER. Disfrutá cada noche de la comodidad y abrigo que necesitás para un buen descanso. Esta manta será tu complemento perfecto para que tengas horas de sueño más reparadoras.",/Hogar/DORMITORIO/FRAZADAS/,3299.0,3299.0,https://www.hiperlibertad.com.ar/frazada-nevada-2pl-petroleo/p,5,471601
Maní Pelado Pehuamar 110 gr,"Mani Pehuamar, desde siempre el sponsor de tus picadas y tus momentos con amigos.",/Almacén/Snacks/Maní/,149.63,149.63,https://www.hiperlibertad.com.ar/man-pelado-pehuamar-110-gr/p,14,471360
Maní CROPPERS sin sal Tostado sin piel x 100g,Maní CROPPERS sin sal Tostado sin piel x 100g,/Almacén/Snacks/Maní/,139.99,139.99,https://www.hiperlibertad.com.ar/mani-croppers-sin-sal-tostado-sin-piel-x-100g/p,56,471358
Doritos Queso 140 gr,Exquisitas tortillas sabor a queso,/Almacén/Snacks/Papas Fritas/,425.99,425.99,https://www.hiperlibertad.com.ar/doritos-queso-140-gr/p,60,471302
Doritos Queso 85 gr,Exquisitas tortillas sabor a queso,/Almacén/Snacks/Papas Fritas/,376.49,376.49,https://www.hiperlibertad.com.ar/doritos-queso-85-gr/p,134,471301
Maicitos Pehuamar 125 gr,"Nuestros Clasicos Palitos sabor queso de siempre, con todo el sabor de Pehuamar para compartir en familia",/Almacén/Snacks/Chizitos/,230.53,230.53,https://www.hiperlibertad.com.ar/maicitos-pehuamar-125-gr/p,72,471288
Palitos Queso Pehuamar 180 gr,"Nuestros Clasicos Palitos sabor queso de siempre, con todo el sabor de Pehuamar para compartir en familia",/Almacén/Snacks/Palitos/,299.49,299.49,https://www.hiperlibertad.com.ar/palitos-queso-pehuamar-180-gr/p,80,471279
Papas Fritas Acanaladas Pehuamar 520 gr,Las tradicionales papas fritas Pehuamar ideales para compartir en familia!,/Almacén/Snacks/Papas Fritas/,798.99,798.99,https://www.hiperlibertad.com.ar/papas-fritas-acanaladas-pehuamar-520-gr/p,23,471277
Papas Fritas Acanaladas Pehuamar 250 gr,Las tradicionales papas fritas Pehuamar ideales para compartir en familia!,/Almacén/Snacks/Papas Fritas/,470.49,470.49,https://www.hiperlibertad.com.ar/papas-fritas-acanaladas-pehuamar-250-gr/p,70,471276
Papas Fritas Pehuamar 245 gr,Las tradicionales papas fritas Pehuamar ideales para compartir en familia!,/Almacén/Snacks/Papas Fritas/,383.42,383.42,https://www.hiperlibertad.com.ar/papas-fritas-pehuamar-245-gr/p,65,471272
RAVIOLES RINA B. PARM PROV 300 GRS,RAVIOLES RINA B. PARM PROV 300 GRS,/PASTAS FRESCAS Y TAPAS/Pastas Rellenas/,489.99,489.99,https://www.hiperlibertad.com.ar/ravioles-rina-b-parm-prov-300-grs/p,10,471245
Gaseosa Coca-Cola Café 220 Ml,"Nada supera el sabor de una Coca-Cola. Diseñado para acompañar cada momento, el sabor de la Coca-Cola es un clásico que perdura desde hace más de 130 años. Una bebida refrescante con extracto de café -hecho a partir de auténticos granos de café- y lista para tomar. Combina el refrescante e irresistible sabor de Coca-Cola con un toque de delicioso café.",/Bebidas/GASEOSAS/OTRAS/,103.49,63.89,https://www.hiperlibertad.com.ar/gaseosa-coca-cola-caf-220-ml/p,84,471101
SOPA KNORR QUICK HECHO CON ZANAHORIA X 5 SOBRES,SOPA KNORR QUICK HECHO CON ZANAHORIA X 5 SOBRES,"/Almacén/Caldos, Sopas y Puré/Sopas/",253.99,253.99,https://www.hiperlibertad.com.ar/sopa-knorr-quick-hecho-con-zanahoria-x-5-sobres/p,779,471026
PAÑALES HUGGIES PROTECT PLUS XXG X 50 U,PAÑALES HUGGIES PROTECT PLUS XXG X 50 U,/Bebés y Niños/PAÑALES Y TOALLITAS HÚMEDAS/PAÑALES/,2147.99,2147.99,https://www.hiperlibertad.com.ar/pa-ales-huggies-protect-plus-xxg-x-50-u/p,6,470792
LAVANDINA AYUDIN TRIPLE PODER P.GL X1,LAVANDINA AYUDIN TRIPLE PODER P.GL X1,/Limpieza/Lavandina/Lavandina en Gel/,142.99,124.99,https://www.hiperlibertad.com.ar/lavandina-ayudin-triple-poder-p-gl-x1/p,2562,470649
RAVIOLES DI PASCUALLE CARNE Y VERDURA B 500 GRS,RAVIOLES DI PASCUALLE CARNE Y VERDURA B 500 GRS,/PASTAS FRESCAS Y TAPAS/Pastas Rellenas/,179.99,179.99,https://www.hiperlibertad.com.ar/ravioles-di-pascualle-carne-y-verdura-b-500-grs/p,106,470470
RAVIOLES DI PASCUALLE RICOTTA 500 GRS,RAVIOLES DI PASCUALLE RICOTTA 500 GRS,/PASTAS FRESCAS Y TAPAS/Pastas Rellenas/,179.99,179.99,https://www.hiperlibertad.com.ar/ravioles-di-pascualle-ricotta-500-grs/p,64,470427
TAPAS DI PASC P EMP ARABE12 UN,TAPAS DI PASC P EMP ARABE12 UN,/PASTAS FRESCAS Y TAPAS/Tapas/,137.99,137.99,https://www.hiperlibertad.com.ar/tapas-di-pasc-p-emp-arabe12-un/p,101,470422
FIDEOS DI PASC MED 500 GRS,FIDEOS DI PASC MED 500 GRS,/PASTAS FRESCAS Y TAPAS/Fideos y ñoquis/,149.99,149.99,https://www.hiperlibertad.com.ar/fideos-di-pasc-med-500-grs/p,48,470419
QUE AZUL TROZADO X 140 GR,QUE AZUL TROZADO X 140 GR,/QUESOS Y FIAMBRES/Quesos/Quesos semiduros/,399.99,399.99,https://www.hiperlibertad.com.ar/que-azul-trozado-x-140-gr/p,5,470373
Avena Quaker Tradicional Fortificada 470 gr,"La avena tradicional de Quaker, ideal para cocinar y sumarle fibra a tus comidas de siempre",/Almacén/Desayuno y Merienda/Cereales/,361.49,361.49,https://www.hiperlibertad.com.ar/avena-quaker-tradicional-fortificada-470-gr/p,54,470360
"JUGO POLVO SER NARANJA JUGOSA 7,5G","JUGO POLVO SER NARANJA JUGOSA 7,5G",/Bebidas/JUGOS/EN POLVO/,41.49,41.49,https://www.hiperlibertad.com.ar/jugo-polvo-ser-naranja-jugosa-7-5g/p,731,470224
MANA VAINILLA CHOCOLATE X 152 GR,MANA VAINILLA CHOCOLATE X 152 GR,/Almacén/Desayuno y Merienda/Galletitas dulces/,118.49,118.49,https://www.hiperlibertad.com.ar/mana-vainilla-chocolate-x-152-gr/p,964,470058
GALLETITAS SONRISAS FRAMBUESA 36X108G,GALLETITAS SONRISAS FRAMBUESA 36X108G,/Almacén/Desayuno y Merienda/Galletitas dulces/,94.96,94.96,https://www.hiperlibertad.com.ar/galletitas-sonrisas-frambuesa-36x108g/p,26,470052
YOGUR ILOLAY FIRME FRUTILLA X 120GR,YOGUR ILOLAY FIRME FRUTILLA X 120GR,/Lácteos/Yogures/Firmes/,59.99,59.99,https://www.hiperlibertad.com.ar/yogur-ilolay-firme-frutilla-x-120gr/p,100,470008
RAVIOLES LA SALTEÑA 4 QUESOS 450 GR,RAVIOLES LA SALTEÑA 4 QUESOS 450 GR,/PASTAS FRESCAS Y TAPAS/Pastas Rellenas/,403.99,403.99,https://www.hiperlibertad.com.ar/rav-ls-4-q-tasty-450-grs/p,57,470001
YOGUR ILOLAY FIRME VAINILLA X 120GR,YOGUR ILOLAY FIRME VAINILLA X 120GR,/Lácteos/Yogures/Firmes/,64.99,64.99,https://www.hiperlibertad.com.ar/yogur-ilolay-firme-vainilla-x-120gr/p,85,469992
MERMELADA FORNERO MEMBRILLO DIET 420GR,MERMELADA FORNERO MEMBRILLO DIET 420GR,/Almacén/Desayuno y Merienda/Mermeladas y Dulces/,162.99,162.99,https://www.hiperlibertad.com.ar/mermelada-fornero-membrillo-diet-420gr/p,8,469960
TERMA POMELO ROS S/AZUC 1350ML,TERMA POMELO ROS S/AZUC 1350ML,/Bebidas/APERITIVOS/SIN ALCOHOL/,263.99,239.99,https://www.hiperlibertad.com.ar/terma-pomelo-ros-s-azuc-1350ml/p,100,469663
BLEM LIMPIA P F ALMENDRA DP45,BLEM LIMPIA P F ALMENDRA DP45,/Limpieza/Limpieza de Pisos y Muebles/Ceras y Autobrillos/,203.49,203.49,https://www.hiperlibertad.com.ar/blem-limpia-p-f-almendra-dp45/p,52,469650
BLEM EMB. CER�MICOS ROJO DP45,BLEM EMB. CER�MICOS ROJO DP45,/Limpieza/Limpieza de Pisos y Muebles/Ceras y Autobrillos/,336.49,336.49,https://www.hiperlibertad.com.ar/blem-emb-cer-micos-rojo-dp45/p,46,469647
CERAMICOL AUTOBRILLO NEG BT80,CERAMICOL AUTOBRILLO NEG BT80,/Limpieza/Limpieza de Pisos y Muebles/Ceras y Autobrillos/,353.49,353.49,https://www.hiperlibertad.com.ar/ceramicol-autobrillo-neg-bt80/p,4,469641
Papas Fritas Lays Queso Crema y Cebolla x 85 gr,Papas fritas clasicas para llevar a la juntada con amigos/as,/Almacén/Snacks/Papas Fritas/,297.99,297.99,https://www.hiperlibertad.com.ar/papas-fritas-lays-queso-crema-cebolla-85-gr/p,347,469575
FIDEOS MOSTACHOL ARCOR X500G,FIDEOS MOSTACHOL ARCOR X500G,/Almacén/Pastas Secas y Salsas/Fideos Guiseros/,125.99,125.99,https://www.hiperlibertad.com.ar/fideos-mostachol-arcor-x500g/p,23,469567
JABÓN ESPADOL ALOE VERA 3X80 GR,JABÓN ESPADOL ALOE VERA 3X80 GR,/Perfumería/Cuidado Personal/Jabones/,423.99,423.99,https://www.hiperlibertad.com.ar/jabon-espadol-aloe-vera-3x80-gr/p,18,469482
ACONDICIONADOR PANTENE MIRAC BRILLO 400ML AC PANTEN PMIRAC BRILLO 400ML,"Pantene con su fórmula multivitaminas nutre tu pelo desde la raíz para que crezca largo y fuerte hasta las puntas. 

El acondicionador de la colección Brillo Extremo de Pantene, está elaborado sin sal y con extracto de perlas, aloe vera, antioxidante, vitamina E y Pro-Vitaminas, remueve impurezas y deja tu pelo hasta 3 veces más sedoso, aumentando el brillo desde el primer uso*. Los niveles de acondicionamiento se han optimizado en todas nuestras colecciones.",/Perfumería/Cuidado Capilar/Acondicionadores/,506.99,506.99,https://www.hiperlibertad.com.ar/acondicionador-pantene-mirac-brillo-400ml/p,18,469249
AVENA TOSTEX TRADICIONAL 300G,Avena tradicional Tostex 300gr,/Almacén/Desayuno y Merienda/Cereales/,198.49,198.49,https://www.hiperlibertad.com.ar/avena-tostex-tradicional-300g/p,1,469182
AVENA TOSTEX GRANO ENTERO 300G,Avena grano entero Tostex 300gr,/Almacén/Desayuno y Merienda/Cereales/,198.49,198.49,https://www.hiperlibertad.com.ar/avena-tostex-grano-entero-300g/p,35,469180
LIMPIADOR LÍQUIDO POETT DES MUSICA 900ML,LIMPIADOR LÍQUIDO POETT DES MUSICA 900ML,/Limpieza/Limpieza de Pisos y Muebles/Limpiadores de Piso/,176.99,176.99,https://www.hiperlibertad.com.ar/limpiador-liquido-poett-des-musica-900ml/p,141,469000
LIMPIADOR LÍQUIDO POETT ALGODON900,LIMPIADOR LÍQUIDO POETT ALGODON900,/Limpieza/Limpieza de Pisos y Muebles/Limpiadores de Piso/,176.99,176.99,https://www.hiperlibertad.com.ar/limpiador-liquido-poett-algodon900/p,142,468999
TE VIRGINIA MTA PEPERINA X25S,TE VIRGINIA MTA PEPERINA X25S,/Almacén/Desayuno y Merienda/Tés/,139.49,139.49,https://www.hiperlibertad.com.ar/te-virginia-mta-peperina-x25s/p,154,468925
QUESO LA PAULINA CREMA ALIOLI X 250GR,QUESO LA PAULINA CREMA ALIOLI X 250GR,/QUESOS Y FIAMBRES/Quesos/Quesos untables/,298.99,298.99,https://www.hiperlibertad.com.ar/queso-la-paulina-crema-alioli-x-250gr/p,24,468924
ENERGIZANTE ROCKSTAR OW PET 500CC,ENERGIZANTE ROCKSTAR OW PET 500CC,/Bebidas/Isotónicas y Energizantes/Energizantes/,176.99,176.99,https://www.hiperlibertad.com.ar/rockstar-ow-pet-500cc/p,269,468923
Tapas Pascualinas Punto&Pasta Hojaldre 400 g,Tapas Pascualinas Punto&Pasta Hojaldre 400 g,/PASTAS FRESCAS Y TAPAS/Tapas/,279.99,279.99,https://www.hiperlibertad.com.ar/tapas-pascualinas-punto-pasta-hojaldre-400-g/p,148,468634
Tapas Para Empanadas Punto & Pasta Hojaldradas Horno x 300 Gr,Tapas Para Empanadas Punto & Pasta Hojaldradas Horno x 300 Gr,/PASTAS FRESCAS Y TAPAS/Tapas/,175.49,175.49,https://www.hiperlibertad.com.ar/tapas-para-empanadas-punto-pasta-hojaldradas-horno-300-gr/p,16,468614
