TE CACHAMAI DE MANZANILLA EN SAQUITOS 20 UN TE CACHAMAI MANZANILLA   X20SQ,"Mouse Logitech Inalámbrico M280 Gris  Creado para la mano. Uso más cómodo para la mano derecha gracias a la forma contorneada con recubrimiento de goma blanda. Seguimiento preciso y uniforme. Precisión y respuesta absolutas con el seguimiento óptico avanzado de Logitech. Nano receptor tipo ""Conectar y olvidar"". Una vez conectado puedes olvidarte de él. El nano receptor ofrece una práctica y fiable conectividad inalámbrica. Duración de pilas de hasta 18 meses. Gracias al diseño para ahorrar energía, tardarás más en cambiar las pilas. Además, M280 entra automáticamente en estado de suspensión cuando no se está usando. Especificaciones Dimensiones (Altura, Anchura y Profundidad): 105,4 x 67,9 x 38,4 mm. Peso: 91,0 g. Compatible con Unifying: Si. Nano receptor dimensiones (Altura, Anchura y Profundidad): 14,4 x 18,7 x 6,1 mm. Peso: 1,8 g. Compatible con Unifying: No. Tecnología de sensor: Seguimiento óptico avanzado de Logitech.",/Almacén/Desayuno y Merienda/Tés/,144.49,144.49,https://www.hiperlibertad.com.ar/te-cachamai-de-manzanilla-en-saquitos-20-un/p,11,4089
Yerba Mate Rosamonte Suave Con Palo 500 Gr YERBA ROSAMONTE S/SUAVE X500GR,Yerba Mate Rosamonte Suave Con Palo 500 Gr,/Almacén/Desayuno y Merienda/Yerbas/,285.37,285.37,https://www.hiperlibertad.com.ar/yerba-mate-rosamonte-suave-con-palo-500-gr/p,104,3093
YERBA MATE LA HOJA X 500 Gr,YERBA MATE LA HOJA X 500 Gr,/Almacén/Desayuno y Merienda/Yerbas/,281.99,281.99,https://www.hiperlibertad.com.ar/yerba-mate-la-hoja-x-500-gr/p,4,3005
Agua H2Oh! Citrus 2.25L,Agua H2Oh! Citrus 2.25L,/Bebidas/Aguas/Aguas saborizadas/,285.49,266.99,https://www.hiperlibertad.com.ar/agua-h2oh-citrus-2-25l/p,4,316
"Agua Saborizada Aquarius Manzana 1,5 Lt","Cambiate al sabor de Aquarius. Disfrutá de la refrescancia de Aquarius y de sus exquisitos sabores: Perá, Manzana, Pomelo, Naranja, Limón y Uva. Descubrí su plataforma Sin Azúcares para los que buscan sabor sin calorías. Nunca es tarde para cambiar. Bienvenido a Aquarius.",/Bebidas/Aguas/Aguas saborizadas/,215.99,215.99,https://www.hiperlibertad.com.ar/agua-saborizada-aquarius-manzana-1-5-lt/p,88,122
"Agua Saborizada Aquarius Pera 1,5 Lt","Cambiate al sabor de Aquarius. Disfrutá de la refrescancia de Aquarius y de sus exquisitos sabores: Perá, Manzana, Pomelo, Naranja, Limón y Uva. Descubrí su plataforma Sin Azúcares para los que buscan sabor sin calorías. Nunca es tarde para cambiar. Bienvenido a Aquarius.",/Bebidas/Aguas/Aguas saborizadas/,215.99,215.99,https://www.hiperlibertad.com.ar/agua-saborizada-aquarius-pera-1-5-lt/p,24,118
CASANCREM INT 290 GR,CASANCREM INT 290 GR,/QUESOS Y FIAMBRES/Quesos/Quesos untables/,712.49,393.49,https://www.hiperlibertad.com.ar/casancrem-int-290-gr/p,38,491230
AIRE ACONDICIONADO SPLIT RCA RP3200F 3200 FC,"Aire Acondicionado Split Rca Frio Calor Rp3200fc 3200watts RP3200FC Tu casa, tu clima ideal. FUNCIÓN NOCTURNA Función Noctura La función nocturna proporciona un ambiente confortable en tu habitación gracias al control preciso de la temperatura y regulación automática de la humedad ambiente DESHUMIDIFICACIÓN Función que permite eliminar la humedad del ambiente y crear un ambiente más saludable y confortable TIMER 24HS Esta función permite programar el horario en el que se desea que el equipo comience a funcionar. FUNCIÓN I FEEL Sensor que ajusta la temperatura automáticamente en función a la cercanía del usuario al control remoto Especificaciones - Capacidad frío: 3.200 Watts - Capacidad calor: 3.200 Watts - Tensión: Monofásico 220-50 - Potencia frío: 1588 Watts - Potencia calor: 1412 Watts - Corriente frío: 7,5 Ampere - Corriente Calor: 6,7 Ampere - Eficiencia Energética (IEE/Letra): A - Eficiencia Energética (COP/Letra): B",/Electrodomésticos/CLIMATIZACIÓN/AIRES ACOONDICIONADOS SPLIT/,114999.0,114999.0,https://www.hiperlibertad.com.ar/aire-acondicionado-split-rca-rp3200f-3200-fc/p,16,491083
Gaseosa Pritty Limón 1.5 lt,Gaseosa Pritty Limón 1.5 lt,/Bebidas/GASEOSAS/LIMÓN/,199.99,159.9,https://www.hiperlibertad.com.ar/gaseosa-pritty-lim-n-1-5-lt/p,0,12034
PIANO L Y S,"Dimensiones: 16,5x4x15 cm - ALCARACION: Modelos sujetos a disponibilidad de stock",/Bebés y Niños/JUGUETERÍA/JUGUETES PRIMERA INFANCIA/,1299.0,1299.0,https://www.hiperlibertad.com.ar/piano-l-y-s/p,6,489985
JUGUETE CAMIONETA FRICCIÓN,Dimensiones: 23x14x13 cm,/Bebés y Niños/JUGUETERÍA/JUGUETES/,1999.0,1999.0,https://www.hiperlibertad.com.ar/juguete-camioneta-fricci-n-2/p,11,489872
JABON LIQUIDO ARIEL DELICATES X 3 Lts,JABON LIQUIDO ARIEL DELICATES X 3 Lts,/Limpieza/Cuidado de la Ropa/Jabón Líquido/,2076.49,2076.49,https://www.hiperlibertad.com.ar/jabon-liquido-ariel-delicates-x-3-lts/p,178,489574
JABON LIQUIDO ARIEL RADIANT X 3 Lts,JABON LIQUIDO ARIEL RADIANT X 3 Lts,/Limpieza/Cuidado de la Ropa/Jabón Líquido/,2076.49,2076.49,https://www.hiperlibertad.com.ar/jabon-liquido-ariel-radiant-x-3-lts/p,219,489330
CELULAR SAMSUNG GALAXY A13 64GB WHITE,"Celular de 6.6"" FHD+ (1080x2408) PLS TFT LCD. Procesador Octa Core (2.0GHz). Camara principal 50 + 5 + 2 + 2 Mp. F1.8, F2.2, F2.4, F2.4. Zoom digital 10x. Camara frontal 8 Mp. F2.2. Flash. Capacidad 64 Gb / RAM 4 Gb. Lector de tarjeta Micro SD. USB Type C 2.0. GPS, Glonass, Galileo, QZSS. Entrada para auricular de 3.5mm. Wi Fi 802.11 a/b/g/n/ac 2.4+5GHz. Bluetooth 5.0. Sistema operativo Android. Navegador Chrome. SIM 1 + Micro SD. Sensores: acelerometro, huella digital, geomagnetico, luz, proximidad. Bateria 5000 mAh.",/Tecnología/CELULARES Y TABLETS/CELULARES/,53999.0,53999.0,https://www.hiperlibertad.com.ar/celular-samsung-galaxy-a13-64gb-white/p,3,488896
DETERGENTE LAVAVAJILLAS MAGISTRAL NARANJA MULTIUSO PLUS X 750 Ml,DETERGENTE LAVAVAJILLAS MAGISTRAL NARANJA MULTIUSO PLUS X 750 Ml,/Limpieza/Limpieza de Cocina/Detergentes/,609.99,609.99,https://www.hiperlibertad.com.ar/detergente-lavavajillas-magistral-naranja-multiuso-plus-x-750-ml/p,1,488572
DETERGENTE LAVAVAJILLAS MAGISTRAL NARANJA MULTIUSO POWER X 500 Ml,"Probá el detergente líquido Magistral Naranja Multiuso Power. Su fórmula tiene un maravilloso poder antigrasa desde la primera pasada. Solo unas gotas Rinden X5* (*Vs. otro detergente). Maravillate con esta fórmula que es súper espesa, genera más espuma y además tiene un delicioso aroma a naranja. - x5 Poder Antigrasa. - Más concentración, rinde mucho más. - Desengrasa platos y más (superficies de cocida, microondas, hornillas, nevera, llantas...). - Fórmula súper espesa. Aroma a naranja. - Más espuma. - Para platos y sartenes aplique 2ml directamente en la esponja. para hornallas, superficies de cocina,hornos, microondas aplique solo unas gotas de magistral directamente en la esponja. - Mantenga fuera del alcance de los niños y animales domésticos. mantenga el producto en un lugar fresco y seco. atención! no mezclar con lavandina. es peligroso para la salud. en caso de contacto con los ojos, lave inmediatamente con abundante agua. enjuague y seque las manos después de usar este producto. en caso de presentarse irritación use guantes y consulte a un médico. en caso de ingestión accidental beba abundante agua. en caso de ingestión no provoque el vómito y consulte inmediatamente al centro de intoxicaciones o al médico llevando el envase o rótulo del producto.",/Limpieza/Limpieza de Cocina/Detergentes/,430.49,242.99,https://www.hiperlibertad.com.ar/detergente-lavavajillas-magistral-naranja-multiuso-power-x-500-ml/p,526,488571
"Megalibro cute: unicornios, sirenas y seres de fantasía","Libro con actividades para jugar e ilustraciones para colorear. Unicornios, animales y personajes adorables habitan el interior de este megalibro",/Librería/LIBRERÍA Y PAPELERÍA/Libros/,569.0,569.0,https://www.hiperlibertad.com.ar/megalibro-cute-unicornios-sirenas-y-seres-de-fantas-a/p,2,487788
Paw Patrol Pintemos,40 páginas para pintar y divertirse.,/Librería/LIBRERÍA Y PAPELERÍA/Libros/,399.9,399.9,https://www.hiperlibertad.com.ar/paw-patrol-pintemos/p,2,487785
POLENTA PRESTO PRONTA X 730 Gr POLENTA PRESTO PRONTA X 730,POLENTA PRESTO PRONTA X 730 Gr,/Almacén/Harinas/Harinas Comunes y Leudantes/,250.49,199.0,https://www.hiperlibertad.com.ar/polenta-presto-pronta-x-730-gr/p,3399,487635
CEREAL INFANTIL NESTUM BANANA X 225 Gr,CEREAL INFANTIL NESTUM BANANA X 225 Gr,"/Almacén/Caldos, Sopas y Puré/Puré/",676.49,676.49,https://www.hiperlibertad.com.ar/cereal-infantil-nestum-banana-x-225-gr/p,2,487613
SHAMPOO DOVE RITUAL DE REPARACION COCO X 200 Ml,SHAMPOO DOVE RITUAL DE REPARACION COCO X 200 Ml,/Perfumería/Cuidado Capilar/Shampoo/,455.99,455.99,https://www.hiperlibertad.com.ar/shampoo-dove-ritual-de-reparacion-coco-x-200-ml-2/p,49,487572
AC DOVE REGEN EXT SUPE X200ML,AC DOVE REGEN EXT SUPE X200ML,/Perfumería/Cuidado Capilar/Acondicionadores/,455.99,455.99,https://www.hiperlibertad.com.ar/acondicionador-dove-regeneraci-n-extrema-superior-x-200-ml/p,34,487566
HELADERA CON FREEZER NEBA A128 124 Lts BLANCA,"Cíclica 2 Frios. - Exterior fabricado en lámina de acero prepintada con protección vinílica. - Interior PsRf (Resistente al Freón). - Contrapuerta PsRf (Resistente al Freón). - Aislación térmica por inyección de poliuretano de alta densidad. - Burlete magnético que evita la pe?rdida de frío y condensación con propiedades anti-hongos. - Condensador en caño tipo Bundy. - Motocompresor blindado con protección térmica. - Serpentina de aluminio, que otorga una mayor vida útil. - Crisper para frutas, verduras y dispenser gravitacional para latas (473cc). - Estantes regulables, resistentes y deslizables. - Fabricadas para soportar hasta 43 grados de temperatura ambiente.",/Electrodomésticos/HELADERAS Y FREEZERS/HELADERAS CÍCLICAS/,83279.0,69999.0,https://www.hiperlibertad.com.ar/heladera-neba-a128-124-lts-blanca/p,2,487353
"JABON LIQUIDO ZORRO BLUE POWER PLUS X 1,4 Lts","JABON LIQUIDO ZORRO BLUE POWER PLUS X 1,4 Lts",/Limpieza/Cuidado de la Ropa/Jabón Líquido/,649.99,649.99,https://www.hiperlibertad.com.ar/jabon-liquido-zorro-blue-power-plus-x-1-4-lts/p,13,487236
STEVIA LEDESMA CERO X 96 SOBRES,STEVIA LEDESMA CERO X 96 SOBRES,/Almacén/Desayuno y Merienda/Azucar y Edulcorantes/,499.49,359.1,https://www.hiperlibertad.com.ar/stevia-ledesma-cero-x-96-sobres/p,199,486813
CREMA DENTAL COLGATE TRIPLE ACCION X 140 Gr,CREMA DENTAL COLGATE TRIPLE ACCION X 140 Gr,/Perfumería/Cuidado Oral/Pastas Dentales/,473.99,473.99,https://www.hiperlibertad.com.ar/crema-dental-colgate-triple-accion-x-140-gr-2/p,98,486802
CREMA DENTAL COLGATE TRIPLE ACCION X 210 Gr,CREMA DENTAL COLGATE TRIPLE ACCION X 210 Gr,/Perfumería/Cuidado Oral/Pastas Dentales/,639.99,639.99,https://www.hiperlibertad.com.ar/crema-dental-colgate-triple-accion-x-210-gr/p,192,486785
CEPILLO DENTAL COLGATE EXTRA CLEAN DURO X 2 U,CEPILLO DENTAL COLGATE EXTRA CLEAN DURO X 2 U,/Perfumería/Cuidado Oral/Cepillos Dentales/,246.49,246.49,https://www.hiperlibertad.com.ar/cepillo-dental-colgate-extra-clean-duro-x-2-u/p,88,486784
PAÑALES PAMPERS TOTAL PROTECT EXTRA PLUS G X 44 U,PAÑALES PAMPERS TOTAL PROTECT EXTRA PLUS G X 44 U,/Bebés y Niños/PAÑALES Y TOALLITAS HÚMEDAS/PAÑALES/,2688.99,2548.49,https://www.hiperlibertad.com.ar/pa-ales-pampers-total-protect-extra-plus-g-x-44-u/p,6,486712
GALLETAS CORMILLOT AVENA Y CACAO X 160 Gr,GALLETAS CORMILLOT AVENA Y CACAO X 160 Gr,/Almacén/Desayuno y Merienda/Galletitas dulces/,146.99,146.99,https://www.hiperlibertad.com.ar/galletas-cormillot-avena-y-cacao-x-160-gr/p,79,486368
CEPILLO DENTAL ORAL-B INDICATOR COLOR COLLECTION PACK FAMILIA X 4 U,CEPILLO DENTAL ORAL-B INDICATOR COLOR COLLECTION PACK FAMILIA X 4 U,/Perfumería/Cuidado Oral/Cepillos Dentales/,970.99,523.79,https://www.hiperlibertad.com.ar/cepillo-dental-oral-b-indicator-color-collection-pack-familia-x-4-u/p,80,486350
CEPILLO DENTAL ORAL-B INDICATOR CLASICO X 2 U,CEPILLO DENTAL ORAL-B INDICATOR CLASICO X 2 U,/Perfumería/Cuidado Oral/Cepillos Dentales/,599.49,323.09,https://www.hiperlibertad.com.ar/cepillo-dental-oral-b-indicator-clasico-x-2-u/p,219,486348
JABON EL POLVO ALA MATIC ECO LAVADO X 3 Kg,JABON EL POLVO ALA MATIC ECO LAVADO X 3 Kg,/Limpieza/Cuidado de la Ropa/Jabón en Polvo/,1170.99,1170.99,https://www.hiperlibertad.com.ar/jabon-el-polvo-ala-matic-eco-lavado-x-3-kg/p,291,486289
JABON EL POLVO ALA LAVADO A MANO CON BICARBONATO DE SODIO X 3 Kg,JABON EL POLVO ALA LAVADO A MANO CON BICARBONATO DE SODIO X 3 Kg,/Limpieza/Cuidado de la Ropa/Jabón en Polvo/,847.99,847.99,https://www.hiperlibertad.com.ar/jabon-el-polvo-ala-lavado-a-mano-con-bicarbonato-de-sodio-x-3-kg/p,30,486286
JABON EN POLVO ALA LAVADO A MANO X 800 Gr,JABON EN POLVO ALA LAVADO A MANO X 800 Gr,/Limpieza/Cuidado de la Ropa/Jabón en Polvo/,260.99,260.99,https://www.hiperlibertad.com.ar/jabon-en-polvo-ala-lavado-a-mano-x-800-gr/p,1068,486281
TAMPONES NOSOTRAS SUPER X 8 U TAMPON NOSOTRAS SUPER X8,TAMPONES NOSOTRAS SUPER X 8 U,/Perfumería/Protección Femenina/Tampones/,242.99,242.99,https://www.hiperlibertad.com.ar/tampones-nosotras-super-x-8-u/p,209,486222
TOALLAS FEMENINAS NOSOTRAS NORMAL X 100 U PROT NOSOTRAS NORMAL X100,TOALLAS FEMENINAS NOSOTRAS NORMAL X 100 U,/Perfumería/Protección Femenina/Protectores Diarios/,882.99,882.99,https://www.hiperlibertad.com.ar/toallas-femeninas-nosotras-normal-x-100-u/p,282,486216
GIN HEREDERO X 700 Ml,GIN HEREDERO X 700 Ml,/Bebidas/Bebidas Blancas y Licores/Bebidas Blancas/,3455.99,3455.99,https://www.hiperlibertad.com.ar/gin-heredero-x-700-ml/p,30,486192
INFUSION A BASE DE CAFE ARLISTAN SUSTENT X 170 Gr,INFUSION A BASE DE CAFE ARLISTAN SUSTENT X 170 Gr,/Almacén/Desayuno y Merienda/Cafés/,960.49,960.49,https://www.hiperlibertad.com.ar/infusion-a-base-de-cafe-arlistan-sustent-x-170-gr/p,17,486185
LECHE LA SERENISIMA LARGA VIDA DESCREMADA 2% X 1 L,LECHE LA SERENISIMA LARGA VIDA DESCREMADA 2% X 1 L,/Lácteos/Leches/Larga Vida/,229.99,229.99,https://www.hiperlibertad.com.ar/leche-la-serenisima-larga-vida-descremada-2-x-1-l/p,99,486176
TOALLAS FEMENINAS NOSOTRAS NORMAL X 16 U TOA NOSOTRAS NORMAL X16,TOALLAS FEMENINAS NOSOTRAS NORMAL X 16 U,/Perfumería/Protección Femenina/Toallitas/,406.49,406.49,https://www.hiperlibertad.com.ar/toallas-femeninas-nosotras-normal-x-16-u/p,296,486173
YOGUR SANCOR VIDA VAINILLA X 1 L,YOGUR SANCOR VIDA VAINILLA X 1 L,/Lácteos/Yogures/Bebibles/,329.99,329.99,https://www.hiperlibertad.com.ar/yogur-sancor-vida-vainilla-x-1-l/p,1,486064
GALLETAS CEREALITAS CLASICAS X 207 Gr,GALLETAS CEREALITAS CLASICAS X 207 Gr,/Almacén/Desayuno y Merienda/Galletitas saladas/,151.49,151.49,https://www.hiperlibertad.com.ar/galletas-cerealitas-clasicas-x-207-gr/p,80,486021
"YOGUR DANONINO VAINILLA X 80,5 Gr","YOGUR DANONINO VAINILLA X 80,5 Gr",/Lácteos/Yogures/Firmes/,161.49,118.4,https://www.hiperlibertad.com.ar/yogur-danonino-vainilla-x-80-5-gr/p,63,485882
YOGUR FIRME YOGURISIMO VAINILLA X 190 Gr,YOGUR FIRME YOGURISIMO VAINILLA X 190 Gr,/Lácteos/Yogures/Firmes/,330.49,207.5,https://www.hiperlibertad.com.ar/yogur-firme-yogurisimo-vainilla-x-190-gr/p,18,485857
POSTRE DANETTE CHOCOLATE CON CREMA X 100 Gr,POSTRE DANETTE CHOCOLATE CON CREMA X 100 Gr,/Lácteos/POSTRES Y FLANES/Postres/,238.49,147.6,https://www.hiperlibertad.com.ar/postre-danette-chocolate-con-crema-x-100-gr/p,16,485840
POSTRE DANETTE DULCE DE LECHE CON CREMA X 100 Gr,POSTRE DANETTE DULCE DE LECHE CON CREMA X 100 Gr,/Lácteos/POSTRES Y FLANES/Postres/,238.49,147.6,https://www.hiperlibertad.com.ar/postre-danette-dulce-de-leche-con-crema-x-100-gr/p,57,485839
LECHE CONDENSADA NESTLE DESCREMADA X 395 Gr,LECHE CONDENSADA NESTLE DESCREMADA X 395 Gr,/Almacén/Desayuno y Merienda/Mermeladas y Dulces/,439.99,439.99,https://www.hiperlibertad.com.ar/leche-condensada-nestle-descremada-x-395-gr/p,367,485764
JUGO DE LIMON FAVINCO X 1 L,JUGO DE LIMON FAVINCO X 1 L,/Almacén/Aceites y Vinagres/Vinagres/,327.07,327.07,https://www.hiperlibertad.com.ar/jugo-de-limon-favinco-x-1-l/p,57,485690
CAPPUCCINO LA VIRGINIA TRADICIONAL X 10 SOBRES,CAPPUCCINO LA VIRGINIA TRADICIONAL X 10 SOBRES,/Almacén/Desayuno y Merienda/Cafés/,451.99,451.99,https://www.hiperlibertad.com.ar/cappuccino-la-virginia-tradicional-x-10-sobres/p,47,485679
MASCARILLA CAPILAR CAPILATIS PH EXTRA ACIDO X 170 Ml,MASCARILLA CAPILAR CAPILATIS PH EXTRA ACIDO X 170 Ml,/Perfumería/Cuidado Capilar/Tratamientos Capilares/,624.99,624.99,https://www.hiperlibertad.com.ar/mascarilla-capilar-capilatis-ph-extra-acido-x-170-ml/p,14,485525
SHAMPOO CAPILATIS PH EXTRA ACIDO X 350 Ml,SHAMPOO CAPILATIS PH EXTRA ACIDO X 350 Ml,/Perfumería/Cuidado Capilar/Shampoo/,889.99,889.99,https://www.hiperlibertad.com.ar/shampoo-capilatis-ph-extra-acido-x-350-ml/p,11,485523
SABORIZADOR PARA HORNO ALICANTE COCINA EN BOLSA HIERBAS Y ESPECIAS X 30 Gr,SABORIZADOR PARA HORNO ALICANTE COCINA EN BOLSA HIERBAS Y ESPECIAS X 30 Gr,"/Almacén/Caldos, Sopas y Puré/Sopas/",176.49,176.49,https://www.hiperlibertad.com.ar/saborizador-para-horno-alicante-cocina-en-bolsa-hierbas-y-especias-x-30-gr/p,55,485481
SABORIZADOR PARA HORNO ALICANTE COCINA EN BOLSA PIMENTON X 30 Gr,SABORIZADOR PARA HORNO ALICANTE COCINA EN BOLSA PIMENTON X 30 Gr,"/Almacén/Caldos, Sopas y Puré/Sopas/",176.49,176.49,https://www.hiperlibertad.com.ar/saborizador-para-horno-alicante-cocina-en-bolsa-pimenton-x-30-gr-2/p,51,485480
SABORIZADOR PARA HORNO ALICANTE COCINA EN BOLSA ALBAHACA Y AJO X 30 Gr,SABORIZADOR PARA HORNO ALICANTE COCINA EN BOLSA ALBAHACA Y AJO X 30 Gr,"/Almacén/Caldos, Sopas y Puré/Sopas/",176.49,176.49,https://www.hiperlibertad.com.ar/saborizador-para-horno-alicante-cocina-en-bolsa-albahaca-y-ajo-x-30-gr/p,52,485472
ESTRAGON ALICANTE X 10 Gr,ESTRAGON ALICANTE X 10 Gr,"/Almacén/Sal, Pimienta y Especias/Hierbas y Especias/",100.49,100.49,https://www.hiperlibertad.com.ar/estragon-alicante-x-10-gr/p,25,485462
CALDO KNORR BALANCE GALLINA DESHIDRATADO X 12 U,CALDO KNORR BALANCE GALLINA DESHIDRATADO X 12 U,"/Almacén/Caldos, Sopas y Puré/Caldos/",207.84,207.84,https://www.hiperlibertad.com.ar/caldo-knorr-balance-gallina-deshidratado-x-12-u/p,5387,485428
MANI KING FRITO SALADO CON PIEL X 500 Gr,MANI KING FRITO SALADO CON PIEL X 500 Gr,/Almacén/Snacks/Maní/,405.49,405.49,https://www.hiperlibertad.com.ar/mani-king-frito-salado-con-piel-x-500-gr/p,245,485423
GIACOMO CAPELETTINI QUESO Y JAMON X 250 Gr,GIACOMO CAPELETTINI QUESO Y JAMON X 250 Gr,/Almacén/Pastas Secas y Salsas/Pastas Secas Rellenas/,307.49,307.49,https://www.hiperlibertad.com.ar/giacomo-capelettini-queso-y-jamon-x-250-gr/p,97,485353
TOALLAS DESINFECTANTES AYUDIN LIMON X 35 U,TOALLAS DESINFECTANTES AYUDIN LIMON X 35 U,/Limpieza/Limpieza de Cocina/Limpiadores/,253.41,253.41,https://www.hiperlibertad.com.ar/toallas-desinfectantes-ayudin-limon-x-35-u/p,13,485274
SMART TV LG 55 PULGADAS 4K UHD 55NANO80,"Televisor Smart de 55"". Panel IPS 4K nanocell. Procesador 4K inteligente a5. 4K active HDR. Resolucion 3840 x 2160. Tasa de refresco 60Hz. Ultra luminance. Escalador 4K. Control de brillo Al. HDR10 pro. Sonido Ultra Surround. Canales 2.0 CH 20W. Salida de audio simultanea. Bluetooth surround ready. Sistema operativo webOS 6.0. Inteligencia artificial LG Al ThinQ. Magic remote. Control por voz. Wi Fi incorporado. Bluetooth. Home dashboard. Google assistant. Apple Homekit. Compartir pantalla. Conectividad: 4 HDMI. 2 USB 2.0. Sintonizador digital incorporado",/Tecnología/TV Y VIDEO/TV LED Y SMART TV/,229999.0,229999.0,https://www.hiperlibertad.com.ar/smart-tv-lg-55-pulgadas-4k-uhd-55nano80/p,2,485254
JABON LIQUIDO ACE POUCH FRESCURA DE PRIMAVERA X 800 Ml,JABON LIQUIDO ACE POUCH FRESCURA DE PRIMAVERA X 800 Ml,/Limpieza/Cuidado de la Ropa/Jabón Líquido/,200.3,200.3,https://www.hiperlibertad.com.ar/jabon-liquido-ace-pouch-frescura-de-primavera-x-800-ml/p,17,485186
LIMPIADOR LIQUIDO MR MUSCULO COCINA EXTRA POWER GATILLO X 500 Ml,LIMPIADOR LIQUIDO MR MUSCULO COCINA EXTRA POWER GATILLO X 500 Ml,/Limpieza/Limpieza de Cocina/Limpiadores/,295.99,295.99,https://www.hiperlibertad.com.ar/limpiador-liquido-mr-musculo-cocina-extra-power-gatillo-x-500-ml/p,25,485177
DESODORANTE DE AMBIENTE GLADE PLACER FLORAL Y FRUTOS ROJOS X 360 Ml,DESODORANTE DE AMBIENTE GLADE PLACER FLORAL Y FRUTOS ROJOS X 360 Ml,/Limpieza/Desodorantes de ambiente/Desodorantes y Desinfentantes/,215.99,215.99,https://www.hiperlibertad.com.ar/desodorante-de-ambiente-glade-placer-floral-y-frutos-rojos-x-360-ml/p,175,485174
ACONDICIONADOR PANTENE PRO V ESSENTIALS CONTROL CAIDA X 400 Ml,ACONDICIONADOR PANTENE PRO V ESSENTIALS CONTROL CAIDA X 400 Ml,/Perfumería/Cuidado Capilar/Acondicionadores/,722.99,359.09,https://www.hiperlibertad.com.ar/acondicionador-pantene-pro-v-essentials-control-caida-x-400-ml/p,102,485160
ACONDICIONADOR PANTENE PRO V ESSENTIALS HIDRATACION INTENSA X 400 Ml,ACONDICIONADOR PANTENE PRO V ESSENTIALS HIDRATACION INTENSA X 400 Ml,/Perfumería/Cuidado Capilar/Acondicionadores/,722.99,359.09,https://www.hiperlibertad.com.ar/acondicionador-pantene-pro-v-essentials-hidratacion-intensa-x-400-ml/p,52,485153
LAVANDINA AYUDIN CLASICA X 4 Lts,LAVANDINA AYUDIN CLASICA X 4 Lts,/Limpieza/Lavandina/Lavandina en Gel/,479.99,479.99,https://www.hiperlibertad.com.ar/lavandina-ayudin-clasica-x-4-lts/p,10,485104
LIMPIADOR LIQUIDO DESINFECTANTE LYSOFORM MULTISUPERFICIES GATILLO X 500 Ml,LIMPIADOR LIQUIDO DESINFECTANTE LYSOFORM MULTISUPERFICIES GATILLO X 500 Ml,/Limpieza/Limpieza de Cocina/Limpiadores/,380.49,380.49,https://www.hiperlibertad.com.ar/limpiador-liquido-desinfectante-lysoform-multisuperficies-gatillo-x-500-ml/p,88,485102
ACONDICIONADOR PANTENE PRO V ESSENTIALS RESTAURACION X 400 Ml,ACONDICIONADOR PANTENE PRO V ESSENTIALS RESTAURACION X 400 Ml,/Perfumería/Cuidado Capilar/Acondicionadores/,722.99,359.09,https://www.hiperlibertad.com.ar/acondicionador-pantene-pro-v-essentials-restauracion-x-400-ml/p,68,485085
TOPO CHICO FRUTILLA 310X6,TOPO CHICO FRUTILLA 310X6,/Bebés y Niños/,199.99,199.99,https://www.hiperlibertad.com.ar/bebida-con-alcohol-topo-chico-frutilla-guayaba-x-310-ml/p,163,484936
GELATINA MOGUL CEREZA X 25 Gr,GELATINA MOGUL CEREZA X 25 Gr,/Almacén/Para preparar/Gelatinas/,111.49,111.49,https://www.hiperlibertad.com.ar/gelatina-mogul-cereza-x-25-gr/p,572,484792
YOGUR BEBIBLE LA SERENISIMA CLÁSICO VAINILLA X 900 Gr,YOGUR BEBIBLE LA SERENISIMA CLÁSICO VAINILLA X 900 Gr,/Lácteos/Yogures/Bebibles/,405.99,257.3,https://www.hiperlibertad.com.ar/yogur-bebible-la-serenisima-cl-sico-vainilla-x-900-gr/p,10,484755
CERVEZA PATAGONIA VERA IPA LATA X 410 Ml,CERVEZA PATAGONIA VERA IPA LATA X 410 Ml,/Bebidas/CERVEZAS/RUBIA/,314.99,314.99,https://www.hiperlibertad.com.ar/cerveza-patagonia-vera-ipa-lata-x-410-ml/p,35,484662
CERVEZA PATAGONIA BOHEMIAN PILSENER LATA X 410 Ml,CERVEZA PATAGONIA BOHEMIAN PILSENER LATA X 410 Ml,/Bebidas/CERVEZAS/RUBIA/,314.99,314.99,https://www.hiperlibertad.com.ar/cerveza-patagonia-bohemian-pilsener-lata-x-410-ml/p,4,484660
CERVEZA PATAGONIA VERA IPA 6 X 410 CC,CERVEZA PATAGONIA VERA IPA 6 X 410 CC,/Bebidas/CERVEZAS/RUBIA/,1889.99,1889.99,https://www.hiperlibertad.com.ar/cerveza-patagonia-vera-ipa-6-410cc/p,58,484659
CERVEZA PATAGONIA 24.7 6 X 410 CC,CERVEZA PATAGONIA 24.7 6 X 410 CC,/Bebidas/CERVEZAS/RUBIA/,1889.99,1889.99,https://www.hiperlibertad.com.ar/cerveza-patagonia-24-7-6-410cc/p,55,484658
BARRA SONIDO 2.1 STROMBERG HALL,"Viví la experiencia completa con el nuevo Stromberg Hall. Este soundbar con subwoofer externo te ofrece la posibilidad de sumergirte en lo que estés viendo, experimentando un sonido con una claridad única gracias a sus potentes bajos. Cuenta con 50 watts de potencia real para amplificar tus sentidos. Tiene entrada HDMI, entrada de cable óptico, entrada auxiliar 3.5mm y conexión bluetooth para que puedas conectarte como quieras y disfrutar. Además del subwoofer externo, tiene 2 parlantes de 2.25 pulgadas para lograr ese sonido excepcional que buscas. Y su diseño sobrio y de vanguardia permite que lo puedas ubicar en cualquier parte del hogar. - Características: Bluetooth - Entrada HDMI ARC - 50 w RMS - 2 parlantes de 2,25” - Entrada cable optical - Entrada auxiliar - Medidas woofer: Alto: 33 cm - Profundidad: 21 cm - Ancho: 37 cm - Medidas woofer embalaje: Alto: 35,5 cm - Profundidad: 21 cm - Ancho: 39 cm - Medidas barra: Alto: 8 cm - Profundidad: 9 cm - Ancho: 80 cm - Medidas barra embalaje: Alto: 13 cm - Profundidad: 13,5 cm - Ancho: 88 cm",/Tecnología/AUDIO/SOUNDBARS/,39999.0,33999.0,https://www.hiperlibertad.com.ar/barra-sonid-2-1-stromberg-hall/p,1,484460
SHAMPOO SEDAL RESTAURACION INSTANTANEA HIDRATACION X 650 ML SH SEDAL REST INS HIDR X650ML,SHAMPOO SEDAL RESTAURACION INSTANTANEA HIDRATACION X 650 ML,/Perfumería/Cuidado Capilar/Shampoo/,674.99,399.99,https://www.hiperlibertad.com.ar/shampoo-sedal-restauracion-instantanea-hidratacion-x-650-ml/p,43,484372
SHAMPOO SEDAL CERAMIDAS X 650 Ml,SHAMPOO SEDAL CERAMIDAS X 650 Ml,/Perfumería/Cuidado Capilar/Shampoo/,674.99,399.99,https://www.hiperlibertad.com.ar/shampoo-sedal-ceramidas-x-650-ml/p,78,484349
PAÑALES HUGGIES TRIPLE PROTECCION XXG X 50 U,PAÑALES HUGGIES TRIPLE PROTECCION XXG X 50 U,/Bebés y Niños/PAÑALES Y TOALLITAS HÚMEDAS/PAÑALES/,2072.49,2072.49,https://www.hiperlibertad.com.ar/pa-ales-huggies-triple-proteccion-xxg-x-50-u/p,66,484231
TOALLAS FEMENINAS KOTEX NOCTURNA CON ALAS X 16 U,TOALLAS FEMENINAS KOTEX NOCTURNA CON ALAS X 16 U,/Perfumería/Protección Femenina/Toallitas/,661.49,607.9,https://www.hiperlibertad.com.ar/toallas-femeninas-kotex-nocturna-con-alas-x-16-u/p,20,484221
MAQUINA DE AFEITAR BIC SHAVE AND TRIM X 2 U,MAQUINA DE AFEITAR BIC SHAVE AND TRIM X 2 U,/Perfumería/Cuidado Personal/PRODUCTOS PARA AFEITARSE/,444.99,444.99,https://www.hiperlibertad.com.ar/maquina-de-afeitar-bic-shave-and-trim-x-2-u/p,82,484216
